Date,Category,Headline,Description,Content,URL
2025-06-08,business,"Man Buys $70,000 Ford After Dealership 'Played With the Numbers' for Him. 2 Years Later, He's Speaking Out - Motor1.com","In a viral video, a man shares that his purchase of a 2023 Ford Explorer was a $70,000 mistake. Here's his review two years later.","A man is being open and honest about his buyers remorse two years after purchasing a 2023 Ford Explorer. The internet is predictably divided on the subject.
This is my two-year review of my $70,000 … [+2768 chars]",https://www.motor1.com/news/761999/70k-ford-buyers-regret/
2025-06-08,business,"Bitcoin bears bet against BTC’s rally, but a short squeeze could follow IF… - AMBCrypto","Retail traders are betting against Bitcoin’s rally, but rising short positions could trigger a squeeze. Could bearish sentiment backfire?","<ul><li>Retail shorts are rising fast, setting the stage for a potential Bitcoin short squeeze.</li><li>Historical patterns showed that bearish sentiment often precedes upside moves when traders get … [+884 chars]",https://ambcrypto.com/bitcoin-bears-bet-against-btcs-rally-but-a-short-squeeze-could-follow-if/
2025-06-08,business,Meta in Talks for Scale AI Investment That Could Top $10 Billion - Bloomberg,"Meta Platforms Inc. is in talks to make a multibillion-dollar investment into artificial intelligence startup Scale AI, according to people familiar with the matter.","Meta Platforms Inc. is in talks to make a multibillion-dollar investment into artificial intelligence startup Scale AI, according to people familiar with the matter. 
The financing could exceed $10 … [+114 chars]",https://www.bloomberg.com/news/articles/2025-06-08/meta-in-talks-for-scale-ai-investment-that-could-top-10-billion
2025-06-08,business,Column | How many years do I have left? An app gave me some helpful insights. - The Washington Post,The app’s motto is: “Know your date. Change your fate. The risk factors and lifestyle changes it suggested got my attention.,"When a friend mentioned that hed used a new artificial-intelligence-powered smartphone app called Death Clock AI to learn when his ticker would give out, I wanted to know my end date as well. I had u… [+6737 chars]",https://www.washingtonpost.com/health/2025/06/08/death-clock-ai-life-expectancy/
2025-06-08,business,Deputies: Over 45 vehicles’ tires slashed in Holland Twp - WOODTV.com,"Over 45 vehicles had their tires slashed in Holland Township early Saturday morning, deputies say.","HOLLAND TOWNSHIP, Mich. (WOOD) Over 45 vehicles had their tires slashed in Holland Township early Saturday morning, deputies say.
On Saturday morning, deputies with the Ottawa County Sheriff’s Offic… [+647 chars]",https://www.woodtv.com/news/ottawa-county/deputies-over-45-vehicles-tires-slashed-in-holland-twp/
2025-06-08,business,Tesla Head of Robotics Exits Company. What That Means for the Stock. - Barron's,,No content available,https://www.barrons.com/articles/tesla-robotics-quits-musk-c23f7796
2025-06-08,business,Cathie Wood says the Musk-Trump feud reveals how much Musk's companies rely on the government - Business Insider,"Musk's companies rely on the US government for their success, Ark Invest CEO Cathie Wood says.","The public feud between Elon Musk and President Donald Trump has shown investors just how much control the US government has over Musk's companies, Ark Invest CEO Cathie Wood says.
""I think the way … [+3013 chars]",https://www.businessinsider.com/cathie-wood-musk-trump-ark-invest-2025-6
2025-06-08,business,‘Do People Not Read the Owner's Manual Anymore?': Woman Buys New Honda. Then She Tries Filling It Up With Gas - Motor1.com,"In a viral video, a woman chronicles her struggle trying to fill up her new Honda as it has a capless system. Here's how it works.","A woman went viral after struggling to put gas in her new Honda, only to leave some viewers just as confused. Krystal (@krissymarie.x), a beauty influencer, told followers she had to call her fiancé … [+3473 chars]",https://www.motor1.com/news/761996/honda-capless-gas-filler/
2025-06-08,business,"AI Is Coming for Your Job, Much Faster Than Anyone Thought - Decrypt",White-collar workers are facing displacement due to AI—and AGI hasn't even arrived yet. Here's why experts are raising alarms.,"In brief
<ul><li>AI is rapidly replacing white-collar jobs. Major tech firms have slashed tens of thousands of jobs in 2025 amid rapid AI integration.</li><li>Reports show that 4080% of white-collar… [+8078 chars]",https://decrypt.co/323916/ai-coming-jobs-faster-anyone-though
2025-06-08,business,Three Big Medical Costs That Retirees Often Underestimate - WSJ,"Drugs, remote locations and concierge care can add tens of thousands of dollars to healthcare costs in retirement","Ray Loewe, an 83-year-old retiree in Lancaster, Pa., spent his career as a financial planner guiding people through the complexities of preparing for retirement. 
But it wasnt until he was well into… [+309 chars]",https://www.wsj.com/health/healthcare/retirement-medical-costs-unexpected-68d48f68
2025-06-08,business,"Terrifying Footage Shows Self-Driving Tesla Get Confused by the Sun, Mow Down Innocent Grandmother - futurism.com","Horrifying footage shows the moment a ""full self-driving"" Tesla plows into a 71 year old woman who had stopped to assist in a crash.","For years, tech entrepreneurs have been preaching that self-driving cars will soon deliver us from our hellscape of vehicular crashes and horrible, fiery deaths.
Among the biggest advocates for the … [+2687 chars]",https://futurism.com/footage-tesla-grandma
2025-06-08,business,How reliable is U.S. economic data? It’s a growing risk for investors awaiting the next Fed rate cut. - MarketWatch,"Questions about inflation and labor-market data could influence the central bank’s decision-making, and potentially impact markets","Investors have been navigating an increasingly hazy outlook for the U.S. economy, as surveys of consumer sentiment have appeared to clash with so-called hard data regarding the state of the labor mar… [+105 chars]",https://www.marketwatch.com/story/how-reliable-is-u-s-economic-data-its-a-growing-risk-for-investors-awaiting-the-next-fed-rate-cut-f477bf0b
2025-06-08,business,Florida farmers now plowing over perfectly good tomatoes as Trump’s tariff policies cause prices to plummet - Yahoo,"Deportations, cheap imports eat into profits.","Tony DiMares family owns 4,000 acres of tomato farms across Florida and California. Sadly, his Florida crops are not looking good mowed over and left to rot, like tomato vines across the state.
But … [+3776 chars]",https://www.yahoo.com/news/florida-farmers-now-plowing-over-130000347.html
2025-06-08,business,Jim Cramer says these hot new stocks are ones to watch - TheStreet,,No content available,https://www.thestreet.com/investing/jim-cramer-says-these-hot-new-stocks-are-ones-to-watch
2025-06-08,business,6 recalls you can’t miss this week - NJ.com,"There were several food, product and car recalls for the week of June 2-8 that you might have missed, including recalls for smoke detectors and sea salt crackers","The safety of consumer goods in the U.S. is of the utmost importance when looking to buy food, products or even automobiles.
However, when these items are recalled, it calls into question how safe t… [+5741 chars]",https://www.nj.com/food/2025/06/6-recalls-you-cant-miss-this-week.html
2025-06-08,business,Viral video claims Jeff Bezos shut down Fifth Avenue to move furniture: 'Amazon Prime for billionaires' | Trending - Hindustan Times - Hindustan Times,A viral TikTok video showed a portion of Fifth Avenue closed reportedly for furniture delivery to Jeff Bezos' penthouse. | Trending,A viral video claimed that a portion of the iconic Fifth Avenue in Manhattan was shut down as Amazon founder Jeff Bezos reportedly had furniture delivered to his penthouse on the Upper East Side. In … [+1782 chars],https://www.hindustantimes.com/trending/viral-video-claims-jeff-bezos-shut-down-fifth-avenue-to-move-furniture-amazon-prime-for-billionaires-101749383551904.html
2025-06-08,business,The One Thing Elon Musk Is Right About - The Bulwark,"He threw a fit about EV credits getting nixed in Trump’s bill. But he’s not wrong that they’re good for America (and Tesla, too).","DONALD TRUMP SAYS HIS PUSH to cut off federal support for electric vehicles was a big impetus for Elon Musks dramatic turn against him this week.
Whether thats really true is anybodys guess.
On the… [+1940 chars]",https://www.thebulwark.com/p/the-one-thing-elon-musk-is-right-about-electric-vehicles
2025-06-08,business,American Airlines passengers forced to take a bus after airplane wasn't allowed to land because it was too big - CBS News,"American Airlines Flight 780 left Philadelphia International Airport on Monday en route to Naples, Italy, but it was diverted before reaching its destination.",Passengers on an American Airlines flight from the United States to Italy were forced to take a bus to their final destination after their aircraft was forced to land 140 miles away because it was to… [+1337 chars],https://www.cbsnews.com/news/american-airlines-flight-708-boeing-7879-naples-italy-united-states/
2025-06-08,business,Chinese hackers and user lapses turn smartphones into a ‘mobile security crisis’ - AP News,"Hackers tied to China's government have tried repeatedly to access the phones of prominent Americans, part of Beijing's sprawling cyberespionage efforts. Smartphones and other mobile devices present significant national security and cybersecurity risks, as fo…","WASHINGTON (AP) 
Cybersecurity investigators noticed a highly unusual software crash it was affecting a small number of smartphones belonging to people who worked in government, politics, tech and j… [+6518 chars]",https://apnews.com/article/china-cybersecurity-hacking-smartphones-37bb5f10c6e21fec2863b1faf269cecc
2025-06-08,general,Carlos Alcaraz rallies past Jannik Sinner in epic French Open final - The Washington Post,The 22-year-old Alcaraz came back from two sets down for the first time in his career to remain undefeated in Grand Slam finals.,"In the second unforgettable No. 1 vs. No. 2 French Open final of the weekend, defending champion Carlos Alcaraz rallied to beat his rival, Italian Jannik Sinner,4-6, 6-7 (7-4), 6-4, 7-6 (7-3), 7-6 (1… [+1719 chars]",https://www.washingtonpost.com/sports/2025/06/08/carlos-alcaraz-wins-french-open-jannik-sinner/
2025-06-08,general,Israel says it has found body of Hamas military leader Mohammed Sinwar - BBC,The Israeli military says Mohammed Sinwar's body was discovered in a tunnel at a hospital.,"Sebastian Usher
The Israeli military released a video in December 2023 that it said showed Mohammed Sinwar being driven through a Hamas underground tunnel
The Israeli military has said it has locat… [+4041 chars]",https://www.bbc.com/news/articles/c62veqrq3yzo
2025-06-08,general,"ABC News suspends correspondent over X post attacking Trump, Stephen Miller - CBS News",An ABC News spokesperson confirmed that the news division suspended Terry Moran pending further evaluation of the incident.,"ABC News on Sunday suspended a senior correspondent following a since-deleted social media post where he criticized White House deputy chief of staff Stephen Miller and President Trump.
Shortly afte… [+2508 chars]",https://www.cbsnews.com/news/terry-moran-abc-news-suspended-x-post-trump-stephen-miller/
2025-06-08,general,Madleen: Israel warns it will stop aid flotilla reaching Gaza - BBC,"Israel's defence minister says climate protester Greta Thunberg and others on board are ""Hamas propaganda spokespeople"".","André Rhoden-Paul
Israel has warned its military will ""take whatever measures are necessary"" to prevent a boat carrying pro-Palestinian activists and humanitarian aid reaching Gaza. 
The Madleen ya… [+2833 chars]",https://www.bbc.com/news/articles/c0r1dvlkrxgo
2025-06-08,general,"Multiple people airlifted after a plane crashes in Tennessee, highway patrol says - CNN","A plane with several people on board has crashed in Coffee County, Tennessee, about 60 miles south of Nashville, according to the Tennessee Highway Patrol.","A plane with several people on board has crashed in Coffee County, Tennessee, about 60 miles south of Nashville, according to the Tennessee Highway Patrol.
Initial reports suggest 1620 people were o… [+1140 chars]",https://www.cnn.com/2025/06/08/us/coffee-county-tennessee-plane-crash
2025-06-08,general,"Kourtney Kardashian and Travis Barker make rare public appearance with son Rocky, 1, at WWE event - Page Six",The Blink-182 rocker and the reality star have been protective over their 1-year-old son since welcoming him in November 2023.,"Kourtney Kardashian and Travis Barker made a rare public appearance with their son, Rocky Thirteen Barker, at WWEs Money in the Bank event.
The Lemme founder was all smiles as she held her 1-year-ol… [+2137 chars]",https://pagesix.com/2025/06/08/parents/kourtney-kardashian-travis-barker-bring-son-rocky-to-wwe-event/
2025-06-08,general,"'Call of Duty: Black Ops 7' to Star Milo Ventimiglia, Kiernan Shipka - Variety","Microsoft's Activision is shaking up its long-running ""Call of Duty"" franchise with a break from tradition and some A-list stars.","Microsoft’s Activision is shaking up its long-running “Call of Duty” franchise with a break from tradition and some A-list stars.
At the conclusion of Xbox Games Showcase 2025 on Sunday, “Call of Du… [+3389 chars]",https://variety.com/2025/gaming/news/call-of-duty-black-ops-7-milo-ventimiglia-kiernan-shipka-1236422511/
2025-06-08,general,Troops arrive in LA as Trump sends National Guard to curb immigration raid protests - NPR,"In Paramount, Calif., confrontations between immigration enforcement agents and protestors last week led to arrests and the use of flash-bang explosives and pepper spray by law enforcement.","Members of the California National Guard arrived in the Los Angeles area Sunday morning, after President Trump activated the troops to curb protests against federal immigration raids that occured in … [+3589 chars]",https://www.npr.org/2025/06/08/nx-s1-5426679/national-guard-california-immigration-protests
2025-06-08,general,"‘Lilo & Stitch’ Nears $800M Global, ‘Mission: Impossible – Final Reckoning’ Tops $450M & ‘Ballerina’ Bows To $51M WW – International Box Office - Deadline","Lilo & Stitch is nearing $800M at the global box office, while Mission: Impossible - Final Reckoning has topped $450M; Ballerina bowed to $51M Worldwide","Refresh for latest…: Disney’s Lilo &amp; Stitch continued to sew up strong business in its third weekend, with the global cume now at $772.6M as it closes in on $800M WW in the coming days. The inter… [+2643 chars]",http://deadline.com/2025/06/lilo-stitch-mission-impossible-ballerina-global-box-office-1236426946/
2025-06-08,general,Mike Johnson downplays Musk's influence and says Republicans will pass Trump's tax and budget bill - AP News,Speaker Mike Johnson took clear sides Sunday in President Donald Trump’s breakup with mega-billionaire Elon Musk. The Republican House leader and staunch Trump ally said Musk’s criticism of the GOP’s massive tax and budget policy bill will not derail the meas…,"With an uncharacteristically feistiness, Speaker Mike Johnson took clear sides Sunday in President Donald Trumps breakup with mega-billionaire Elon Musk.
The Republican House leader and staunch Trum… [+4165 chars]",https://apnews.com/article/donald-trump-elon-musk-big-beautiful-bill-33db5c5422bd4573c78f8f9481502c73
2025-06-08,general,Justin Bieber posts cryptic message about 'transactional relationships' after fans begged him to 'get help' - Page Six,The “Peaches” crooner penned a message about “transactional relationships” after sparking fan concern with odd bathroom selfies on Saturday.,"Justin Bieber penned a cryptic message about friendships in a new rant after fans begged him to “get help.”
“Tired of transactional relationships,” the “Peaches” crooner wrote via Instagram Sunday. … [+2247 chars]",https://pagesix.com/2025/06/08/celebrity-news/justin-bieber-posts-cryptic-message-about-transactional-relationships-after-fans-begged-him-to-get-help/
2025-06-08,general,Xbox Games Showcase 2025: all the news and trailers - The Verge,"Microsoft brought ROG Xbox Ally portable gaming news, Gears of War E-Day, and more to its Xbox Games Showcase 2025 event.","Capping off a verybusyweek in the world of gaming is Microsoft with its annual Xbox Games Showcase, providing a look at brand-new games and updates from across our first-party studios and our incredi… [+10559 chars]",https://www.theverge.com/microsoft-xbox/681149/xbox-games-showcase-2025-news-trailers
2025-06-08,general,Kayla Harrison survived sex abuse to win Olympic gold. She's now a UFC champ with a mega fight ahead - AP News,"Around her neck or around her waist, Kayla Harrison has a knack for winning gold. Harrison is a two-time Olympic judo gold medalist. She's now a UFC champion after winning the 135-pound title in front of a packed house that included President Donald Trump and…","NEWARK, N.J. (AP) Around her neck or around her waist, Kayla Harrison has a knack for winning gold.
One key distinction, of course, between the Olympics and professional mixed martial arts is what h… [+6233 chars]",https://apnews.com/article/mma-ufc-harrison-trump-c29770e88de3491bf9d42913fd29f38c
2025-06-08,general,"This Diet Could Reduce Your Risk of Dementia by up to 25%, New Study Reveals - SciTechDaily","Adopting the MIND diet, even later in life, is associated with a reduced risk of developing dementia. As the U.S. population grows older and dementia cases continue to rise, many people are wondering: can anything be done to prevent this devastating disease? …","A new study shows the MIND diet may reduce dementia risk, though benefits differ across racial groups. Credit: Shutterstock
Adopting the MIND diet, even later in life, is associated with a reduced r… [+4763 chars]",https://scitechdaily.com/this-diet-could-reduce-your-risk-of-dementia-by-up-to-25-new-study-reveals/
2025-06-08,general,"Manhunt for Travis Decker continues as roadblocks, forest closure lifted - KOMO",Hundreds of law enforcement agents continue to search dozens of structures and forested areas in the ongoing investigation to find accused killer Travis Decker.,"CHELAN COUNTY, Wash. Hundreds of law enforcement personnel continue to search dozens of structures and forested areas in the ongoing investigation to locate accused killer Travis Decker. 
The Chelan… [+5125 chars]",https://komonews.com/news/local/manhunt-for-travis-decker-continues-as-roadblocks-lifted-in-some-search-areas-ugitive-accused-of-killing-daughters-manhunt-girls-campground-national-forest-survivalist-army-ptsd-homeless-mental-illness-search-investigation-governor-pacific-crest
2025-06-08,general,NASA's Parker Solar Probe spots powerful magnetic explosion aimed at the sun's surface - Live Science,NASA's Parker Solar Probe has directly observed a powerful magnetic explosion in the sun's corona that could help us predict geomagnetic storms on Earth.,"While making a death-defying dive through the sun’s atmosphere, NASA's Parker Solar Probe has directly recorded a powerful plasma explosion heading toward our star’s surface in unprecedented detail.… [+4361 chars]",https://www.livescience.com/space/the-sun/nasas-parker-solar-probe-spots-powerful-magnetic-explosion-aimed-at-the-suns-surface
2025-06-08,general,"NBA Finals Parlay Tonight: +270 Bet for Sunday, June 8 - Action Network","Read for our NBA same game parlay for Pacers vs. Thunder Game 2 in the NBA Finals on Sunday, June 8.","The Thunder will host the Pacers in Game 2 of the NBA Finals at the Paycom Center tonight. Tipoff is scheduled for 8:00 p.m. ET on ABC.
Continue below for my NBA parlay for Sunday, June 8.
NBA Fina… [+1295 chars]",https://www.actionnetwork.com/nba/nba-same-game-parlay-tonight-xxx-bet-for-sunday-june-8-qs
2025-06-08,general,The NASA science missions that would be axed in Trump’s 2026 budget - The Washington Post,Deep cuts would upend missions to study other planets and Earth itself.,"Return to menuThe twin spacecraft, launched in 1977 and renowned for producing stunning images of the outer solar system, are now the most distant objects ever sent into space by humans. Voyager 1 is… [+2813 chars]",https://www.washingtonpost.com/science/2025/06/08/nasa-budget-voyager-space/
2025-06-08,technology,Super Meat Boy 3D Announced for an Early 2026 Release - IGN,"Super Meat Boy returned in all his gory glory at today's Xbox Games Showcase, in the unveiling of Super Meat Boy 3D. It's exactly what it sounds like: a 3D Super Meat Boy game, and it's coming to Xbox, PlayStation, and PC in early 2026.","Super Meat Boy returned in all his gory glory at today's Xbox Games Showcase, in the unveiling of Super Meat Boy 3D. It's exactly what it sounds like: a 3D Super Meat Boy game, and it's coming to Xbo… [+1809 chars]",https://www.ign.com/articles/super-meat-boy-3d-announced-for-an-early-2026-release
2025-06-08,technology,Final Fantasy 16 shadow drops onto Xbox Series X|S - TrueAchievements,"During the Xbox Games Showcase, Square Enix dropped a bombshell by announcing that Final Fantasy 16  is out today on Xbox Series X|S.",No content available,https://www.trueachievements.com/news/final-fantasy-16-xbox-shadow-drop
2025-06-08,technology,Outer Worlds 2 Is Xbox's First $80 Video Game - Kotaku,Microsoft is joining Nintendo and selling its first $80 video game later this year,"Todays Xbox Summer Game Fest showcase was a solid hour of big and small announcements, including a new Call of Duty trailer and the reveal of Xboxs handheld PC device. But it also brought us our firs… [+1765 chars]",https://kotaku.com/outer-worlds-2-xbox-80-price-tag-sgf-rpg-mario-kart-1851784014
2025-06-08,technology,Gears of War: E-Day is coming in 2026 - The Verge,Microsoft is announcing a release date for Gears of War: E-Day. The latest entry in the sci-fi shooter series debuts in the same year that Gears of War turns 20.,"E-Day will release in the same year that marks 20 years since Gears of War debuted on the Xbox 360.
E-Day will release in the same year that marks 20 years since Gears of War debuted on the Xbox 360… [+1362 chars]",https://www.theverge.com/news/682283/gears-of-war-e-day-release-date-2026
2025-06-08,technology,"'Call of Duty: Black Ops 7' to Star Milo Ventimiglia, Kiernan Shipka - Variety","Microsoft's Activision is shaking up its long-running ""Call of Duty"" franchise with a break from tradition and some A-list stars.","Microsoft’s Activision is shaking up its long-running “Call of Duty” franchise with a break from tradition and some A-list stars.
At the conclusion of Xbox Games Showcase 2025 on Sunday, “Call of Du… [+3389 chars]",https://variety.com/2025/gaming/news/call-of-duty-black-ops-7-milo-ventimiglia-kiernan-shipka-1236422511/
2025-06-08,technology,"Double Fine's Next Game, Keeper, Has You Controlling a Walking Lighthouse Driven by a Goofy Bird - IGN","Following Psychonauts 2, Double Fine has been hard at work on a new game that was just revealed at today's Xbox Games Showcase. It's called Keeper, and it puts you in the wobbly legs of a walking sapient lighthouse driven by a silly-looking bird.","Following Psychonauts 2, Double Fine has been hard at work on a new game that was just revealed at today's Xbox Games Showcase. It's called Keeper, and it puts you in the wobbly legs of a walking sap… [+1310 chars]",https://www.ign.com/articles/double-fines-next-game-keeper-has-you-controlling-a-walking-lighthouse-driven-by-a-goofy-bird
2025-06-08,technology,Gears of War Reloaded PS5 Gameplay Showcased for the First Time at Xbox Showcase - Push Square,Fenix down,"Subscribe to Push Square on YouTube157k
Weve all had ample time to accept that Gears of War is coming to the PS5, but we havent actually had a chance to see it in motion yet.
But that changed durin… [+524 chars]",https://www.pushsquare.com/news/2025/06/gears-of-war-reloaded-ps5-gameplay-showcased-for-the-first-time-at-xbox-showcase
2025-06-08,technology,Rumoured Persona 4 remake officially revealed - Eurogamer,The rumoured Persona 4 remake has finally been officially revealed at today's Xbox Games Showcase.,"The rumoured Persona 4 remake has finally been officially revealed at today's Xbox Games Showcase.
Titled Persona 4 Revival, it's set for release across Xbox Series X/S, PC, and PS5. It will also be… [+1304 chars]",https://www.eurogamer.net/rumoured-persona-4-remake-officially-revealed
2025-06-08,technology,Beast of Reincarnation coming from Pokémon dev Game Freak in 2026 - Polygon,Game Freak trades in the Pokéballs for a sword with Beast of Reincarnation.,"Game Freak, best known for its work on Pokémon games, unveiled a new look and title for its upcoming project on Sunday during the Xbox Games Showcase. Beast of Reincarnation is headed to Xbox Series … [+1126 chars]",https://www.polygon.com/gaming/605353/beast-of-reincarnation-pokemon-dev-game-freak-2026
