Date,Category,Headline,Description,Content,URL
2025-06-04,technology,"Mario Kart World 1.1.0 update out now, patch notes - Nintendo Everything","Mario Kart World gets version 1.1.0 update in time for launch on Nintendo Switch 2, and you can check out the patch notes.","Alongside the launch of Mario Kart World, Nintendo has prepared a version 1.1.0 update. Those who are starting to get access to Nintendo Switch 2 can download it now.
The patch brings along various … [+1222 chars]",https://nintendoeverything.com/mario-kart-world-1-1-0-update-out-now-patch-notes/
2025-06-04,technology,Ex-Apple Designer Reveals 'Living Glass' iOS 26 Concepts - MacRumors,"Designer Sebastiaan de With has published an impressive preview of what Apple's rumored iOS redesign might look like, complete with detailed...","Designer Sebastiaan de With has published an impressive preview of what Apple's rumored iOS redesign might look like, complete with detailed mockups and a design philosophy that he believes could res… [+4785 chars]",https://www.macrumors.com/2025/06/04/ex-apple-designer-living-glass-ios-concepts/
2025-06-04,technology,A number of first-party Switch games are getting patches to run properly on Switch 2 - Video Games Chronicle,"Separate from the free upgrades, other titles are getting fixes to ensure backwards compatibility works correctly","Nintendo has been releasing patches for numerous Switch games to ensure they work properly on Switch 2.
As noted on Bluesky by dataminer OatmealDome, patches have been released for a number of Switc… [+4413 chars]",https://www.videogameschronicle.com/news/a-number-of-first-party-switch-games-are-getting-patches-to-run-properly-on-switch-2/
2025-06-04,technology,"CD Projekt Red clarifies Unreal showcase of Witcher 4 was tech demo, not gameplay - GamesIndustry.biz",CD Projekt Red has emphasised that footage of The Witcher 4 showcased at State of Unreal 2025 was not gameplay.,"CD Projekt Red has emphasised that footage of The Witcher 4 showcased at State of Unreal 2025 was not gameplay.
As reported by VGC, the developer said it was a ""first look at the cutting edge techno… [+2586 chars]",https://www.gamesindustry.biz/cd-projekt-red-clarifies-unreal-showcase-of-witcher-4-was-tech-demo-not-gameplay
2025-06-04,technology,BOE files lawsuit against Samsung for Z Fold displays - SamMobile,"Samsung Display has been fighting a patent infringement case against its Chinese rival BOE. Today, it was revealed that the US International Trade Commission (ITC) has come to a preliminary conclusion that BOE infringed upon Samsung Display's patent. That giv…","In April this year, Samsung filed a patent infringement lawsuit against the BOE, claiming that the Chinese display maker has been poaching the South Korean tech giants employees and stealing the comp… [+1301 chars]",https://www.sammobile.com/news/samsung-oled-patent-win-over-boe-itc-ruling/
