Date,Category,Headline,Description,Content,URL
2025-06-05,business,Exclusive | Kimberly-Clark Nears Roughly $3.5 Billion Sale of International Tissue Business - WSJ,The maker of Kleenex is expected to sell the tissue business outside of North America to Brazil’s Suzano,"Kimberly-ClarkKMB-0.77%decrease; red down pointing triangle
is nearing a sale of its Kleenex and tissue businesses outside of North America for around $3.5 billion, part of an attempt by the maker o… [+498 chars]",https://www.wsj.com/business/deals/kimberly-clark-nears-roughly-3-5-billion-sale-of-international-tissue-business-299c17d5
2025-06-05,business,"Circle Prices IPO at $31 Per Share, Valuing Stablecoin Issuer at $6.9 Billion - CoinDesk","Circle’s IPO exceeds expectations with a surge in demand, pushing shares above the marketed range.","Circle priced its initial public offering (IPO) on Wednesday at $31 per share, above the expected range of $24 to $26.
The company sold around 34 million shares in the offering for a valuation of $1… [+2426 chars]",https://www.coindesk.com/markets/2025/06/04/circle-debuts-on-nyse-at-31-per-share-valuing-stablecoin-issuer-at-62-billion
2025-06-04,business,"Treasuries Rally on Fed Cut Hopes, Stocks Hit Peak: Markets Wrap - Bloomberg",Asian shares opened cautiously after weak US economic data reinforced expectations for Federal Reserve interest rate cuts this year.,"Asian shares opened cautiously after weak US economic data reinforced expectations for Federal Reserve interest rate cuts this year.
A regional gauge swung between small gains and losses at the open… [+260 chars]",https://www.bloomberg.com/news/articles/2025-06-04/stock-market-today-dow-s-p-live-updates
2025-06-04,business,How airline fees have turned baggage into billions - BBC,The amount carriers now charge for luggage is raising the ire of politicians and consumer groups.,"Sam Gruet
Airlines in the US alone made $7.27bn from check-in luggage fees last year
With Air Canada and Southwest the latest airlines to charge passengers for check-in luggage, the ballooning cost… [+5564 chars]",https://www.bbc.com/news/articles/c0qg3ylx2g9o
2025-06-04,business,Fastest Payout Online Casinos 2025: Black Lotus Expands Customer Payment Options - GlobeNewswire,"As a move to solidify its position as the fastest payout casino in 2025, Black Lotus has taken a calculated step by expanding its payment systems ......","Las Vegas, June 04, 2025 (GLOBE NEWSWIRE) -- 
As a move to solidify its position as the fastest payout casino in 2025, Black Lotus has taken a calculated step by expanding its payment systems 
Blac… [+9739 chars]",https://www.globenewswire.com/news-release/2025/06/04/3094048/0/en/Fastest-Payout-Online-Casinos-2025-Black-Lotus-Expands-Customer-Payment-Options.html
2025-06-04,business,All flights grounded at Newark Airport due to staffing issues - FOX 5 New York,"The FAA implemented a ground stop at Newark Liberty International Airport on Wednesday evening due to ongoing staffing shortages, an issue that has been plaguing the transit hub,",NEW YORK - The FAA issued a ground stop on all flights at Newark Liberty International Airport Wednesday evening as New York City's second-busiest airport continues to struggle with staffing shortage… [+1414 chars],https://www.fox5ny.com/news/newark-airport-ground-stop-staffing
2025-06-04,business,"The two rules investors need to follow right now as the S&P 500 eyes a return to 6,000 - MarketWatch","The S&P 500 is back near 6,000 despite tariffs and bond-market angst","The stock market has almost regained a foothold at the 6,000 level, recovering over a tumultuous eight weeks in which it fell almost 20% into a bear market.
Big round numbers dont necessarily signal… [+150 chars]",https://www.marketwatch.com/story/the-two-rules-investors-need-to-follow-right-now-as-the-s-p-500-eyes-a-return-to-6-000-31696abd
2025-06-04,business,Wall Street’s big rally stalls following some discouraging economic data - AP News,"Wall Street’s big recent rally lost some momentum following a pair of potentially discouraging reports on the economy. The S&P 500 finished Wednesday virtually flat and remained 2.8% below its all-time high. The Dow Jones Industrial Average fell 91 points, an…","NEW YORK (AP) Wall Streets big recent rally lost some momentum on Wednesday following a pair of potentially discouraging reports on the economy.
The S&amp;P 500 finished the day virtually unchanged … [+4776 chars]",https://apnews.com/article/stocks-markets-tariffs-trump-steel-cfaa9c8adc0658ae9a2759c56dc2bde2
2025-06-04,business,"Doritos, Cheetos, M&Ms and other popular snacks will soon have warning labels in Texas - KHOU",Big changes are coming for junk food junkies in the Lone Star State.,"HOUSTON Junk food warning labels are coming soon to a store aisle near you. 
The Texas Legislature just approved a bipartisan bill that requires a clear warning for processed snacks, baked goods, dr… [+3445 chars]",https://www.khou.com/article/news/local/texas/texas-junk-food-warning-label/285-df01fbe7-cfe3-4b12-a90b-ec872144e102
2025-06-04,business,Higher-Earning Shoppers Hit the Dollar Store as Spending Tightens - WSJ,,No content available,https://www.wsj.com/business/retail/higher-earning-shoppers-hit-the-dollar-store-as-spending-tightens-e6c0f80b
2025-06-04,business,Jacksonville Hooters abruptly closes - firstcoastnews.com,The location opened in April 2007.,"JACKSONVILLE, Fla. A popular chicken wing chain location off Southside Boulevard abruptly shut its doors Wednesday.
A spokesperson for Hooters confirmed to First Coast News that its location at 4521… [+1337 chars]",https://www.firstcoastnews.com/article/news/local/jacksonville-southside-boulevard-hooters-abruptly-closes/77-98af6874-b637-4373-b3ad-60c0aa06625d
2025-06-04,business,"Weak jobs data sparks talk of a Fed rate cut — plus, Amazon's new AI investment - CNBC","Every weekday, the Investing Club releases the Homestretch; an actionable afternoon update just in time for the last hour of trading.",No content available,https://www.cnbc.com/2025/06/04/weak-jobs-data-sparks-talk-of-a-fed-rate-cut-plus-amazons-new-ai-investment.html
2025-06-04,business,"Reddit sues Anthropic, alleging its bots accessed Reddit more than 100,000 times since last July - The Verge",Anthropic previously claimed to have stopped crawling Reddit in May of 2024.,"Anthropic previously claimed to have stopped crawling Reddit in May of 2024.
Anthropic previously claimed to have stopped crawling Reddit in May of 2024.
Reddit sued Anthropic on Wednesday in San F… [+2587 chars]",https://www.theverge.com/ai-artificial-intelligence/679768/reddit-sues-anthropic-alleging-its-bots-accessed-reddit-more-than-100000-times-since-last-july
2025-06-04,business,"Ground beef sold at Whole Foods might be contaminated with E. coli, USDA warns - CNN",The US Department of Agriculture’s Food Safety and Inspection Service has issued a public health alert for some raw ground beef products sold at Whole Foods Market because of a risk of E. coli contamination.,The US Department of Agricultures Food Safety and Inspection Service has issued a public health alert for some raw ground beef products sold at Whole Foods Market because of a risk of E. colicontamin… [+2314 chars],https://www.cnn.com/2025/06/04/health/whole-foods-ground-beef-alert
2025-06-04,business,Subway owner buys mega-popular chicken chain in $1 billion deal - AL.com,One of the hottest names in chicken restaurants has a new owner.,"One of the hottest names in chicken restaurants has a new owner.
Roark Capital, the company that owns Subway sandwich chain, has acquired Daves Hot Chicken in a $1 billion deal. USA Today confirmed … [+1339 chars]",https://www.al.com/news/2025/06/subway-owner-buys-mega-popular-chicken-chain-in-1-billion-deal.html
2025-06-04,business,"Most companies are already raising prices or plan to because of tariffs, data shows - CNBC",Two different surveys show most firms plan to pass along tariff costs to consumers.,"Data from the New York Federal Reserve shows a majority of companies have passed along at least some of President Donald Trump's tariffs onto customers, the latest in a growing body of evidence indic… [+3514 chars]",https://www.cnbc.com/2025/06/04/companies-already-raise-prices-or-plan-to-blaming-tariffs-data-shows.html
2025-06-04,business,"Fed 'Beige Book' economic report cites declining growth, rising prices and slow hiring - CNBC","The report noted that ""economic activity has declined slightly since the previous report"" released April 23.","The U.S. economy has contracted over the past six weeks as hiring has slowed and consumers and businesses worried about tariff-related price increases, according to a Federal Reserve report Wednesday… [+2443 chars]",https://www.cnbc.com/2025/06/04/fed-beige-book-economic-report-cites-declining-growth-rising-prices-and-slow-hiring.html
2025-06-05,general,"Trump orders investigation into Biden's actions as president, ratcheting up targeting of predecessor - AP News","President Donald Trump is directing his administration to investigate Joe Biden’s actions as president, alleging aides masked his predecessor’s “cognitive decline” and raising questions about his use of the autopen to sign pardons and other documents. The ord…","WASHINGTON (AP) President Donald Trump on Wednesday directed his administration to investigate Joe Bidens actions as president, alleging aides masked his predecessors cognitive decline and casting do… [+5890 chars]",https://apnews.com/article/joe-biden-investigation-autopen-james-comer-ae7013baea1f3da5417d02a6e83811ec
2025-06-05,general,Cuomo took heat for a ‘shuck and jive’ comment during the Obama era - Politico,An opponent dredged up the years-old racially insensitive remark.,No content available,https://www.politico.com/live-updates/2025/06/04/1st-nyc-mayoral-primary-debate/cuomo-shuck-and-jive-mamdani-comment-00388683
2025-06-05,general,Exclusive | Kimberly-Clark Nears Roughly $3.5 Billion Sale of International Tissue Business - WSJ,The maker of Kleenex is expected to sell the tissue business outside of North America to Brazil’s Suzano,"Kimberly-ClarkKMB-0.77%decrease; red down pointing triangle
is nearing a sale of its Kleenex and tissue businesses outside of North America for around $3.5 billion, part of an attempt by the maker o… [+498 chars]",https://www.wsj.com/business/deals/kimberly-clark-nears-roughly-3-5-billion-sale-of-international-tissue-business-299c17d5
2025-06-05,general,‘Wicked: For Good’ Trailer: Ariana Grande and Cynthia Erivo Put Glinda and Elphaba to the Test in Dazzling First Footage From Sequel - Variety,The official trailer for 'Wicked: For Good' has been released by Universal Pictures.,"It’s time to venture back to the Emerald City.
Universal has released the official trailer for “Wicked: For Good,” the second part to 2024’s hit Broadway movie adaptation.
“Wicked: For Good” brings… [+1414 chars]",https://variety.com/2025/film/news/wicked-for-good-trailer-ariana-grande-cynthia-erivo-sequel-1236208527/
2025-06-05,general,Sean 'Diddy' Combs trial recap: Witness testifies that Combs dangled her off 17th-floor balcony and threatened to kill her - Yahoo,Bryana Bongolan told the court that  Combs held her over the railing at Cassie Ventura’s apartment before slamming her into the balcony's furniture.,"The trial of Sean Diddy Combs continued Wednesday in Manhattan federal court, with two more witnesses a forensic video expert and a woman who said Combs once dangled her off a balcony taking the stan… [+6899 chars]",https://www.yahoo.com/news/sean-diddy-combs-trial-recap-witness-testifies-that-combs-dangled-her-off-17th-floor-balcony-and-threatened-to-kill-her-200539157.html
2025-06-05,general,Trump moves to block U.S. entry for foreigners planning to study at Harvard University - CNBC,"President Donald Trump is moving to block nearly all foreign students from entering the country to attend Harvard University, his latest attempt to choke the Ivy League school from an international pipeline that accounts for a quarter of the student body.","President Donald Trump is moving to block nearly all foreign students from entering the country to attend Harvard University, his latest attempt to choke the Ivy League school from an international p… [+1185 chars]",https://www.cnbc.com/2025/06/04/trump-moves-to-block-us-entry-for-foreigners-planning-to-study-at-harvard-university-.html
2025-06-05,general,Knicks stars party in NYC after playoff ouster — hours before Tom Thibodeau firing - New York Post,"The Knicks seemed to be in high spirits on Monday night, less than 24 hours before head coach Tom Thibodeau was fired.","The Knicks seemed to be in high spirits on Monday night, less than 24 hours before head coach Tom Thibodeau was fired, as Jalen Brunson, Karl-Anthony Towns, Josh Hart, Mikal Bridges and company parti… [+2598 chars]",https://nypost.com/2025/06/04/sports/knicks-stars-party-in-nyc-hours-before-tom-thibodeau-firing/
2025-06-04,general,Judge bars Trump administration from deporting family of Boulder attack suspect - The Washington Post,A federal judge barred the Trump administration from deporting the wife and children of an Egyptian man accused of throwing molotov cocktails at a pro-Israel demonstration in Colorado.,A federal judge on Wednesday barred the Trump administration from deporting the wife and children of an Egyptian man accused of throwing molotov cocktails at a pro-Israel demonstration in Colorado af… [+7158 chars],https://www.washingtonpost.com/immigration/2025/06/04/trump-boulder-family-deportation-colorado/
2025-06-04,general,"Texas vs Texas Tech game score: Replay, highlights as UT wins Game 1 of WCWS finals - Austin American-Statesman",All-American catcher Reese Atwood gets a late hit to lift the Longhorns past Texas Tech in Game 1 of finals series at Women’s College World Series.,OKLAHOMA CITY Texas softball moved to within one win if its first national championship after a dramatic 2-1 victory over Texas Tech in the first game of the Women's College World Series Wednesday at… [+6177 chars],https://www.statesman.com/story/sports/college/longhorns/softball/2025/06/04/women-college-world-series-score-today-texas-texas-tech-softball/83724972007/
2025-06-04,general,Texas woman dies from brain-eating amoeba after clearing sinuses with tap water - Dallas News,A 71-year-old Texas woman died after contracting a brain-eating amoeba at a campground.,"A Texas woman died after contracting a brain-eating amoeba from tap water used to clear out her sinuses. 
The 71-year-old, who was not identified, fell ill within four days of using a nasal irrigati… [+2066 chars]",https://www.dallasnews.com/news/public-health/2025/06/04/texas-woman-dies-from-brain-eating-amoeba-after-clearing-sinuses-with-tap-water/
2025-06-04,general,Final Fantasy Tactics Remake Is Happening: Trailer And Release Date Announced During State Of Play - GameSpot,"After months of rumors and speculation, Square Enix revealed the return of Final Fantasy's tactical spin-off with enhanced graphics and fully voiced character dialogue.",Square Enix announced the heavily rumored Final Fantasy Tactics remaster is indeed real with a new trailer revealed ruing the PlayStation State of Play presentation. The trailer also came with a rele… [+1620 chars],https://www.gamespot.com/articles/final-fantasy-tactics-remake-is-happening-trailer-and-release-date-announced-during-state-of-play/1100-6532075/
2025-06-04,general,"Nioh 3 Announced for PS5, Demo Out Now for Two Weeks - Push Square",Try the new action game today,"Subscribe to Push Square on YouTube157k
Koei Tecmo has announced Nioh 3 will release for PS5 in early 2026, but you can get a taste of the latest Team Ninja game in a time-limited demo available now… [+856 chars]",https://www.pushsquare.com/news/2025/06/nioh-3-announced-for-ps5-demo-out-now-for-two-weeks
2025-06-04,general,What is the CBO? A look at the small office inflaming debate over Trump’s tax bill - AP News,A small government office with some 275 employees has found itself caught in the political crossfire as Congress debates President Donald Trump’s “one big beautiful bill.” The Congressional Budget Office has projected that the legislation would increase feder…,"WASHINGTON (AP) A small government office with some 275 employees has found itself caught in the political crossfire as Congress debates President Donald Trumps one big beautiful bill. 
The Congress… [+5614 chars]",https://apnews.com/article/cbo-big-beautiful-bill-trump-republican-deficit-debt-d432b67a965790e4a26de46ea8db1266
2025-06-04,general,Have You Seen This? Hungry wild elephant raids grocery store for snacks - KSL News,A hungry wild elephant has caused havoc in a grocery store in Thailand after strolling in from the Khao Yai National Park and helping himself to the food on the shelves.,"BANGKOK A hungry wild elephant caused havoc in a grocery store in Thailand on Monday when he strolled in from a nearby national park and helped himself to food on the shelves.
Videos of the incident… [+1877 chars]",https://www.ksl.com/article/51324816/have-you-seen-this-hungry-wild-elephant-raids-grocery-store-for-snacks
2025-06-04,general,Leah Remini reveals where she stands with Jennifer Lopez after their falling out - New York Post,Leah Remini revealed if she’s back on Jenny’s block.,"Leah Remini is back on Jenny’s block.
The “King of Queens” actress, 54, has rekindled her friendship with Jennifer Lopez after an alleged rift.
Right after the divorce, wed text each other loving m… [+3719 chars]",https://nypost.com/2025/06/04/entertainment/leah-remini-on-where-she-stands-with-jennifer-lopez-after-rift/
2025-06-04,general,A new satellite TV channel allows Alexei Navalny's videos to reach Russian audiences - NPR,"The Russia's Future channel, launched by Navalny's widow Yulia Navalnaya and Reporters Without Borders, began broadcasting Wednesday, on what would have been the late Russian activist's 49th birthday.","PARIS Starting Wednesday, Russians will be able to watch a new TV channel featuring political content that was previously banned from Russian airwaves.
The channel, called Russia's Future, is a join… [+3182 chars]",https://www.npr.org/2025/06/04/g-s1-70456/navalny-rsf-russia-tv-channel-launch
2025-06-04,general,"The two rules investors need to follow right now as the S&P 500 eyes a return to 6,000 - MarketWatch","The S&P 500 is back near 6,000 despite tariffs and bond-market angst","The stock market has almost regained a foothold at the 6,000 level, recovering over a tumultuous eight weeks in which it fell almost 20% into a bear market.
Big round numbers dont necessarily signal… [+150 chars]",https://www.marketwatch.com/story/the-two-rules-investors-need-to-follow-right-now-as-the-s-p-500-eyes-a-return-to-6-000-31696abd
2025-06-04,technology,Final Fantasy Tactics Remake Is Happening: Trailer And Release Date Announced During State Of Play - GameSpot,"After months of rumors and speculation, Square Enix revealed the return of Final Fantasy's tactical spin-off with enhanced graphics and fully voiced character dialogue.",Square Enix announced the heavily rumored Final Fantasy Tactics remaster is indeed real with a new trailer revealed ruing the PlayStation State of Play presentation. The trailer also came with a rele… [+1620 chars],https://www.gamespot.com/articles/final-fantasy-tactics-remake-is-happening-trailer-and-release-date-announced-during-state-of-play/1100-6532075/
2025-06-04,technology,"Nioh 3 Announced for PS5, Demo Out Now for Two Weeks - Push Square",Try the new action game today,"Subscribe to Push Square on YouTube157k
Koei Tecmo has announced Nioh 3 will release for PS5 in early 2026, but you can get a taste of the latest Team Ninja game in a time-limited demo available now… [+856 chars]",https://www.pushsquare.com/news/2025/06/nioh-3-announced-for-ps5-demo-out-now-for-two-weeks
2025-06-04,technology,New filament lets you 3D-print parts in authentic 1980s Apple computer color - Ars Technica,Mac fan paid $900 to color-match iconic Apple beige-gray “Platinum” plastic for everyone.,No content available,https://arstechnica.com/apple/2025/06/new-filament-lets-you-3d-print-parts-in-authentic-1980s-apple-computer-color/
2025-06-04,technology,James Bond game 007 First Light gets first trailer - The Verge,"Hitman developer IO Interactive revealed the first look at James Bond game 007 First Light, which launches in 2026.","More will be revealed later this week.
More will be revealed later this week.
Sonys showcase had a pleasant surprise: the debut trailer for 007 First Light. The James Bond game which has some defin… [+792 chars]",https://www.theverge.com/news/679909/007-first-light-trailer-james-bond
2025-06-04,technology,Mortal Kombat: Legacy Kollection Is a Classic Fighting Bundle With New Features Coming Later This Year - IGN,"Digital Eclipse’s next game collection is Mortal Kombat: Legacy Kollection, a bundle of classic fighting games that includes some of the series’ oldest entries with new features.","Digital Eclipses next game collection is Mortal Kombat: Legacy Kollection, a bundle of classic fighting games that includes some of the series oldest entries with new features.
The company behind ot… [+2907 chars]",https://www.ign.com/articles/mortal-kombat-legacy-kollection-is-a-classic-fighting-bundle-with-new-features-coming-later-this-year
2025-06-04,technology,Here’s how much storage space the Switch 2 actually has - Polygon,Switch 2’s 256 GB of built-in internal storage isn’t all available for games and other user data. Here’s how much the system eats up at launch.,Nintendo Switch 2 will launch with 256 GB of internal storage eight times the storage size of the original Switch. But some portion of that advertised 256 GB of storage is gobbled up by the Switch 2s… [+1173 chars],https://www.polygon.com/nintendo-switch-2/603892/storage-space-capacity-size-ufs
2025-06-04,technology,Wyze Says ‘Screw It’ and Shoves a Camera Into Its Latest Smart Bulb - Gizmodo,We can't decide if this is a great or terrible idea for your smart home.,"A famous meme once asked, “Why don’t we have both?” Clearly Wyze agrees. Its latest smart home gadget is the Wyze Bulb Cam, which is exactly what the name impliesa smart bulb that’s also a camera or … [+2137 chars]",https://gizmodo.com/wyze-bulb-cam-smart-light-bulb-camera-2000611203
2025-06-04,technology,Walmart Nintendo Switch 2 pre-order confirmed: what time it'll be in stock online - The Shortcut | Matt Swider,"Walmart has confirmed that it'll have an online Switch 2 pre-order restock, and we've tracked down the time and where to buy it","The Walmart Nintendo Switch 2 pre-order time for online orders has been confirmed for tonight, according to Walmart reps who sent a statement to The Shortcut.
Both the Walmart Switch 2 and Switch 2 … [+3530 chars]",https://www.theshortcut.com/p/walmart-nintendo-switch-2-pre-order-tonight
2025-06-04,technology,"Review: At $349, AMD’s 16GB Radeon RX 9060 XT is the new midrange GPU to beat - Ars Technica","If that $349 price is real then it’s a great deal; if it’s not real, it depends.",No content available,https://arstechnica.com/gadgets/2025/06/review-at-349-amds-16gb-radeon-rx-9060-xt-is-the-new-midrange-gpu-to-beat/
2025-06-04,technology,Review | 5 AI bots took our tough reading test. One was smartest — and it wasn’t ChatGPT. - The Washington Post,"We challenged AI helpers to decode legal contracts, simplify medical research, speed-read a novel and make sense of Trump speeches. Some of the AI analysis was impressive — and some was downright dumb.","Return to menuSo is that good or bad? Both Claude and ChatGPT produced some analysis that knocked it out of the park, the judges said.
Repeatedly during his evaluations of those two tools, Bohjalian… [+1322 chars]",https://www.washingtonpost.com/technology/2025/06/04/ai-summarizers-analysis-test-documents-books/
2025-06-04,technology,Elden Ring Nightreign haters: Bloodborne is right there - Polygon,Bloodborne did co-op before it was cool with Chalice Dungeons. Here’s why it holds up 10 years after release.,"Elden Ring Nightreign has shot out of the gates, selling 2 million copies its first day, yet the critical and player reception hasnt reached the same highs that most of FromSoftwares games do. Matchm… [+2676 chars]",https://www.polygon.com/gaming/602971/elden-ring-nightreign-haters-need-to-pick-up-this-10-year-old-masterpiece
2025-06-04,technology,"Nintendo Switch 2 Day 1 Update Required for Backwards Compatibility, Nintendo Switch Online, Virtual Game Cards, eShop, More - IGN","Nintendo Switch 2 requires a day one update to unlock major parts of the console's capabilities, including the ability to play Nintendo Switch 1 games.","Nintendo Switch 2 requires a day one update to unlock major parts of the console's capabilities, including the ability to play Nintendo Switch 1 games.
The new console is finally available right now… [+2764 chars]",https://www.ign.com/articles/nintendo-switch-2-day-1-update-required-for-backwards-compatibility-nintendo-switch-online-virtual-game-cards-eshop-more
2025-06-04,technology,"These iPhones, Macs, iPads may not support Apple’s new software - 9to5Mac","iOS 26, iPadOS 26, and macOS 26 are expected to drop support for a variety of models of iPhone, iPad, and Mac devices.","Next week, Apple will unveil major new software updates including iOS 26, iPadOS 26, and macOS 26, but rumors indicate these releases will drop support for a variety of existing devices. Here are the… [+1433 chars]",https://9to5mac.com/2025/06/04/these-iphones-macs-and-ipads-may-not-support-apples-new-software/
