Date,Category,Headline,Description,Content,URL
2025-06-08,technology,Nintendo Switch 2 Welcome Tour - Welcome To Paid User Guides (Review) - The Jimquisition,"Nintendo Switch 2 Welcome TourReleased: June 5th, 2025Developer: Nintendo's WorstPublisher: Nintendo's TemeritySystems: Switch 2I thought leading the charge on standardizing an $80 base price for so-called “AAA” videogames was a new low for Nintendo. You can …","Nintendo Switch 2 Welcome Tour
Released: June 5th, 2025
Developer: Nintendo's Worst
Publisher: Nintendo's Temerity
Systems: Switch 2
I thought leading the charge on standardizing an $80 base pri… [+6672 chars]",https://www.thejimquisition.com/post/nintendo-switch-2-welcome-tour-welcome-to-paid-user-guides-review
2025-06-08,technology,"Hollow Knight: Silksong comes out of hiding, with a 2025 release date promise - Polygon","Hollow Knight: Silksong launches in 2025. The release date was announced during Xbox Games Showcase. It will be on PlayStation, PC, and Xbox, too.","Congrats, patient bug lovers: Hollow Knight: Silksong will be out later this year, Microsoft confirmed Sunday at its Xbox Games Showcase. Microsofts Sarah Bond announced that release window alongside… [+1687 chars]",https://www.polygon.com/news/23160254/hollow-knight-silksong-release-date-trailer
2025-06-08,technology,"Third Plague Tale Game Revealed for PS5, Out Next Year - Push Square",Resonance: A Plague Tale Legacy,"Subscribe to Push Square on YouTube157k
Update [Sun 8th Jun 2025, 6:15pm]: Confirmed as part of the Xbox Games Showcase, prequel game Resonance: A Plague Tale Legacy is now official. It's coming to … [+864 chars]",https://www.pushsquare.com/news/2025/06/third-plague-tale-game-revealed-for-ps5-out-next-year
2025-06-08,technology,Xbox Games Showcase 2025: all the news and trailers - The Verge,"Microsoft brought ROG Xbox Ally portable gaming news, Gears of War E-Day, and more to its Xbox Games Showcase 2025 event.","Capping off a verybusyweek in the world of gaming is Microsoft with its annual Xbox Games Showcase, providing a look at brand-new games and updates from across our first-party studios and our incredi… [+10559 chars]",https://www.theverge.com/microsoft-xbox/681149/xbox-games-showcase-2025-news-trailers
2025-06-08,technology,"After Silent Hill 2, Cronos: The New Dawn Might Complete Bloober Team's Redemption Arc - GameSpot",The team's follow-up to the Silent Hill 2 remake is looking impressive in its own right.,"When the Silent Hill 2 remake proved to be so good, some were slow to give Bloober Team much credit, citing how it had a strong blueprint to build from. It's true that Konami's landmark original is a… [+4664 chars]",https://www.gamespot.com/articles/after-silent-hill-2-cronos-the-new-dawn-might-complete-bloober-teams-redemption-arc/1100-6532234/
2025-06-08,technology,US: GameStop offering 20% bonus if you trade in Nintendo Switch because you have Switch 2 - My Nintendo News,,No content available,https://news.google.com/rss/articles/CBMixAFBVV95cUxNTEZDcW5XOE5NbnIySEZCaHVIZ0xvaXVxVnhXZkpHeWtCQThxZTY1MlVrQ1hNOGFoLVJYS2dhaDI4eEJxNWl2d2hBbVZFY3VjalpXcDhURXR1RW15bDMzSnA0RUVGWS16Vno2bVdBeVFydkFxcXY0MWk4MWVGaFdkNHBkYVRFZ3NZQm1PZ3NGTUlsZTVMWElwX2JHT3VfTjFfRTZOeWtVOXcxMC03OHZEc0VxNVV2bEt6TFVuUnhLeTBYQk5V?oc=5
2025-06-08,technology,Pioneering Apple engineer Bill Atkinson dies at 74 - TechCrunch,"Bill Atkinson, an engineer who played a key role in the development of the Macintosh and other landmark Apple products, has died of pancreatic cancer.","Bill Atkinson, an engineer who played a key role in the development of the Macintosh and other landmark Apple products, has died of pancreatic cancer. 
After Atkinsons family announced his passing o… [+828 chars]",https://techcrunch.com/2025/06/08/pioneering-apple-engineer-bill-atkinson-dies-at-74/
2025-06-08,technology,"Gearbox publishes statement to confirm its games do not contain ""spyware"" as players slam new EULA - Eurogamer","Gearbox has confirmed via a statement that its games do not contain ""spyware"" after fans had ""concerns about Take-Two's…","Gearbox has confirmed via a statement that its games do not contain ""spyware"" after fans had ""concerns about Take-Two's terms of service"".
The statement, published to Steam, explicitly states that G… [+3370 chars]",https://www.eurogamer.net/gearbox-publishes-statement-to-confirm-its-games-do-not-contain-spyware-as-players-slam-new-eula
2025-06-08,technology,"At WWDC 25, Apple should make amends with developers after AI shortfalls and lawsuits - TechCrunch",Apple has an opportunity to deliver a WWDC that would encourage developers to invest more of their time in the ecosystem.,"There was palpable excitement around Apple’s Worldwide Developer Conference (WWDC) last year. The company was about to unveil its AI capabilities, with the tech world expecting the company to unveil … [+4996 chars]",https://techcrunch.com/2025/06/08/at-wwdc-25-apple-should-make-amends-with-developers-after-ai-shortfalls-and-lawsuits/
2025-06-08,technology,The USB-C dream is dead and it’s too late to revive it - Android Authority,"USB-C aimed to unify charging and data, but years later, compatibility problems and complex specs make it a headache for consumers worldwide.","Ive been writing about USB-C for what seems like forever (seriously, its been seven or eight years!). From a unifying, one-size-fits-all specification to the grim reality of compatibility issues and … [+9536 chars]",https://www.androidauthority.com/usb-c-cant-be-fixed-3560127/
